<?xml version="1.0" encoding="UTF-8"?>
<!DOCTYPE modules-definition SYSTEM "modules-definition-v10.dtd">
<modules-definition>
  <modules>
    <module id="1" short-name="Keyboard" limit="1" cycles="0.0" prog-mem="0.0" x-mem="0.0" y-mem="0.0" zero-page="3.0" dyn-mem="1.0" height="2" >
      <output id="0" name="Note" type="control" />
      <output id="1" name="gate" type="logic" />
      <output id="2" name="velocity on" type="control" />
      <output id="3" name="velocity off" type="control" />
    </module>
    <module id="2" short-name="AudioIn" cycles="2.2" prog-mem="1.0" x-mem="1.0" y-mem="1.0" zero-page="2.0" dyn-mem="1.0" height="2" >
      <output id="0" name="left" type="audio" />
      <output id="1" name="right" type="audio" />
    </module>
    <module id="3" short-name="4Output" cycles="2.0625" prog-mem="0.46875" x-mem="0.09375" y-mem="0.0" zero-page="0.0" dyn-mem="0.28125" height="3" >
      <input id="0" name="out 1" type="audio" />
      <input id="1" name="out 2" type="audio" />
      <input id="2" name="out 3" type="audio" />
      <input id="3" name="out 4" type="audio" />
      <parameter id="0" name="level" min="0" max="127" bit-count="7" />
    </module>
    <module id="4" short-name="2Output" cycles="1.40625" prog-mem="0.34375" x-mem="0.09375" y-mem="0.09375" zero-page="0.0" dyn-mem="0.375" height="3" >
      <input id="0" name="out left" type="audio" />
      <input id="1" name="out right" type="audio" />
      <parameter id="0" name="level" min="0" max="127" bit-count="7" />
      <parameter id="1" name="destination" min="0" max="2" bit-count="2" use-substitution="channel-select-out2" />
      <parameter id="2" name="mute" min="0" max="1" bit-count="1" use-substitution="off-on" />
    </module>
    <module id="5" short-name="1Output" cycles="1.28125" prog-mem="0.3125" x-mem="0.09375" y-mem="0.09375" zero-page="0.0" dyn-mem="0.375" height="3" >
      <input id="0" name="out" type="audio" />
      <parameter id="0" name="level" min="0" max="127" bit-count="7" />
      <parameter id="1" name="dest" min="0" max="5" bit-count="3" use-substitution="channel-select-out1" />
      <parameter id="2" name="mute" min="0" max="1" bit-count="1" use-substitution="off-on" />
    </module>
    <module id="7" short-name="OscA" cycles="10.8125" prog-mem="6.5625" x-mem="0.84375" y-mem="0.34375" zero-page="1.75" dyn-mem="0.375" height="6" >
      <input id="0" name="sync" type="audio" />
      <input id="1" name="FMA" type="audio" />
      <input id="2" name="pitch 1" type="audio" />
      <input id="3" name="pitch 2" type="audio" />
      <input id="4" name="pulse width mod" type="audio" />
      <output id="0" name="out" type="audio" />
      <output id="1" name="slv" type="slave" />
      <custom id="0" name="freq display units" min="0" max="1" />
      <parameter id="0" name="freq coarse" min="0" max="127" bit-count="7" default="64" use-substitution="note" />
      <parameter id="1" name="freq fine" min="0" max="127" bit-count="7" default="64" use-substitution="offset-64" />
      <parameter id="2" name="freq KBT" min="0" max="127" bit-count="7" default="64" use-substitution="freq-kbt" />
      <parameter id="3" name="Pulse width" min="0" max="127" bit-count="7" default="64" use-substitution="transform-pulse-width" />
      <parameter id="4" name="waveform" min="0" max="3" bit-count="2" use-substitution="oscillator-wave" />
      <parameter id="5" name="pitch mod 1" min="0" max="127" bit-count="7" />
      <parameter id="6" name="pitch mod 2" min="0" max="127" bit-count="7" />
      <parameter id="7" name="fma mod" min="0" max="127" bit-count="7" />
      <parameter id="8" name="PW mod" min="0" max="127" bit-count="7" />
      <parameter id="9" name="Mute" min="0" max="1" bit-count="1" use-substitution="off-on" />
    </module>
    <module id="8" short-name="OscB" cycles="8.28125" prog-mem="6.25" x-mem="0.6875" y-mem="0.5" zero-page="1.75" dyn-mem="0.6875" height="6" >
      <input id="0" name="FMA" type="audio" />
      <input id="1" name="pitch 1" type="control" />
      <input id="2" name="pitch 2" type="control" />
      <input id="3" name="PW mod" type="control" />
      <output id="0" name="out" type="audio" />
      <output id="1" name="slv" type="slave" />
      <custom id="0" name="freq display units" min="0" max="1" />
      <parameter id="0" name="Freq coarse" min="0" max="127" bit-count="7" default="64" use-substitution="note" />
      <parameter id="1" name="Freq fine" min="0" max="127" bit-count="7" default="64" use-substitution="offset-64" />
      <parameter id="2" name="Freq KBT" min="0" max="127" bit-count="7" default="64" use-substitution="freq-kbt" />
      <parameter id="3" name="waveform" min="0" max="3" bit-count="2" use-substitution="oscillator-wave" />
      <parameter id="4" name="pitch mod 1" min="0" max="127" bit-count="7" />
      <parameter id="5" name="pitch mod 2" min="0" max="127" bit-count="7" />
      <parameter id="6" name="fma mod" min="0" max="127" bit-count="7" />
      <parameter id="7" name="PWidth" min="0" max="127" bit-count="7" />
      <parameter id="8" name="mute" min="0" max="1" bit-count="1" use-substitution="off-on" />
    </module>
    <module id="9" short-name="OscC" cycles="4.96875" prog-mem="1.09375" x-mem="0.5625" y-mem="0.09375" zero-page="1.75" dyn-mem="0.53125" height="4" >
      <input id="0" name="FMA" type="audio" />
      <input id="1" name="pitch" type="audio" />
      <input id="2" name="AM" type="audio" />
      <output id="0" name="out" type="audio" />
      <output id="1" name="slv" type="slave" />
      <custom id="0" name="freq display units" min="0" max="1" />
      <parameter id="0" name="pitch coarse" min="0" max="127" bit-count="7" default="64" use-substitution="note" />
      <parameter id="1" name="pitch fine" min="0" max="127" bit-count="7" default="64" use-substitution="offset-64" />
      <parameter id="2" name="pitch KBT" min="0" max="1" bit-count="1" default="1" use-substitution="off-on" />
      <parameter id="3" name="pitch mod amount" min="0" max="127" bit-count="7" />
      <parameter id="4" name="FMA" min="0" max="127" bit-count="7" />
      <parameter id="5" name="mute" min="0" max="1" bit-count="1" use-substitution="off-on" />
    </module>
    <module id="10" short-name="OscSlvB" cycles="7.125" prog-mem="2.15625" x-mem="0.21875" y-mem="0.34375" zero-page="0.875" dyn-mem="0.5" height="3" >
      <input id="0" name="mst" type="slave" />
      <input id="1" name="PWmod" type="audio" />
      <output id="0" name="out" type="audio" />
      <custom id="0" name="freq display units" min="0" max="2" />
      <parameter id="0" name="detune coarse" min="0" max="127" bit-count="7" default="64" />
      <parameter id="1" name="detune fine" min="0" max="127" bit-count="7" default="64" use-substitution="offset-64" />
      <parameter id="2" name="PW" min="0" max="127" bit-count="7" use-substitution="transform-pulse-width" />
      <parameter id="3" name="PW mod" min="0" max="127" bit-count="7"  default="64" />
      <parameter id="4" name="mute" min="0" max="1" bit-count="1" use-substitution="off-on" />
    </module>
    <module id="11" short-name="OscSlvC" cycles="6.0" prog-mem="1.75" x-mem="0.15625" y-mem="0.21875" zero-page="0.875" dyn-mem="0.5" height="3" >
      <input id="0" name="mst" type="slave" />
      <input id="1" name="FMA" type="audio" />
      <output id="0" name="out" type="audio" />
      <custom id="0" name="freq display units" min="0" max="2" />
      <parameter id="0" name="detune coarse" min="0" max="127" bit-count="7" use-substitution="offset-64" />
      <parameter id="1" name="detune fine" min="0" max="127" bit-count="7" use-substitution="offset-64" />
      <parameter id="2" name="FMA mod" min="0" max="127" bit-count="7" />
      <parameter id="3" name="mute" min="0" max="1" bit-count="1" use-substitution="off-on" />
    </module>
    <module id="12" short-name="OscSlvD" cycles="5.875" prog-mem="1.3125" x-mem="0.15625" y-mem="0.21875" zero-page="0.875" dyn-mem="0.4375" height="3" >
      <input id="0" name="mst" type="slave" />
      <input id="1" name="FMA" type="audio" />
      <output id="0" name="out" type="audio" />
      <custom id="0" name="freq display units" min="0" max="2" />
      <parameter id="0" name="detune coarse" min="0" max="127" bit-count="7" use-substitution="offset-64" />
      <parameter id="1" name="detune fine" min="0" max="127" bit-count="7" use-substitution="offset-64" />
      <parameter id="2" name="FMA mod" min="0" max="127" bit-count="7" />
      <parameter id="3" name="mute" min="0" max="1" bit-count="1" use-substitution="off-on" />
    </module>
    <module id="13" short-name="OscSlvE" cycles="3.0625" prog-mem="0.6875" x-mem="0.34375" y-mem="0.15625" zero-page="0.875" dyn-mem="0.4375" height="3" >
      <input id="0" name="mst" type="slave" />
      <input id="1" name="FMA" type="audio" />
      <input id="2" name="AM" type="audio" />
      <output id="0" name="out" type="audio" />
      <custom id="0" name="freq display units" min="0" max="2" />
      <parameter id="0" name="detune coarse" min="0" max="127" bit-count="7" use-substitution="offset-64" />
      <parameter id="1" name="detune fine" min="0" max="127" bit-count="7" use-substitution="offset-64" />
      <parameter id="2" name="FMA mod" min="0" max="127" bit-count="7" />
      <parameter id="3" name="mute" min="0" max="1" bit-count="1" use-substitution="off-on" />
    </module>
    <module id="14" short-name="OscSlvA" cycles="7.625" prog-mem="5.875" x-mem="0.4375" y-mem="0.28125" zero-page="0.875" dyn-mem="0.5" height="4" >
      <input id="0" name="mst" type="slave" />
      <input id="1" name="FMA" type="audio" />
      <input id="2" name="sync" type="audio" />
      <input id="3" name="AM" type="audio" />
      <output id="0" name="out" type="audio" />
      <custom id="0" name="freq display units" min="0" max="2" />